{
  "$schema": "http://json-schema.org/draft-07/schema#",
  "title": "Client Brief",
  "description": "Structured client data used by onboard-client.mjs to populate Sanity and generate AI-HANDOFF.md.",
  "type": "object",
  "required": ["business", "services", "areas"],
  "properties": {
    "trade": {
      "type": "string",
      "description": "Trade pack used to seed default content — must match a pack in studio/scripts/trade-packs (e.g. 'plumber', 'electrician'). The SEED_TRADE env var overrides this for the seed; if neither is set it defaults to 'plumber'.",
      "default": "plumber"
    },
    "business": {
      "type": "object",
      "required": ["name", "phone", "email", "website"],
      "properties": {
        "name": { "type": "string", "description": "Trading name — e.g. 'Vanguard Plumbing & Heating'" },
        "legalName": { "type": "string", "description": "Registered company name (optional)" },
        "shortDescription": { "type": "string", "description": "One-liner — e.g. 'Painter and decorator covering South Manchester'" },
        "description": { "type": "string", "description": "Longer company description for structured data (optional)" },
        "slogan": { "type": "string" },
        "foundingDate": { "type": "string", "description": "YYYY-MM-DD (optional)" },
        "phone": { "type": "string", "description": "Primary business phone — becomes canonical NAP phone" },
        "email": { "type": "string", "description": "Public contact email" },
        "website": { "type": "string", "description": "Full URL — e.g. 'https://www.example.com'" },
        "whatsappNumber": { "type": "string", "description": "International format without + — e.g. '447700000000'. Leave blank to hide WhatsApp button." },
        "priceRange": { "type": "string", "description": "e.g. '££' or '£50-£500'" },
        "differentiators": {
          "type": "array",
          "items": { "type": "string" },
          "description": "2-4 things that GENUINELY set this client apart (e.g. 'family-run since 1998', 'all engineers DBS-checked', 'free thermal-imaging leak survey'). The copy generator uses these to keep every client's site unique + true — two same-trade clients only diverge on real facts, so this is required raw material, not fluff. Use ONLY true, client-confirmed claims."
        },
        "yearsTrading": { "type": "string", "description": "e.g. '15' — only if accurate; used for 'established' framing." }
      }
    },
    "address": {
      "type": "object",
      "description": "Leave empty {} if service-area-only business (no public address).",
      "properties": {
        "streetAddress": { "type": "string" },
        "addressLocality": { "type": "string", "description": "City / town" },
        "addressRegion": { "type": "string", "description": "County / region" },
        "postalCode": { "type": "string" },
        "addressCountry": { "type": "string", "default": "GB" },
        "latitude": { "type": "number" },
        "longitude": { "type": "number" }
      }
    },
    "social": {
      "type": "array",
      "items": { "type": "string" },
      "description": "Full profile URLs — Facebook, Instagram, LinkedIn, X, etc."
    },
    "trust": {
      "type": "object",
      "description": "Powers the Trust Bar blocks (settings.trust). Leave any part out to hide it. UK law (DMCC Act 2024) treats fake credentials as illegal — only enter claims that are true and verifiable. ('As featured in' press logos need an image upload, so add those in Studio.)",
      "properties": {
        "stat": {
          "type": "object",
          "description": "Headline trust stat shown in the trust bar.",
          "properties": {
            "headline": { "type": "string", "description": "e.g. 'Since 2011'" },
            "sub": { "type": "string", "description": "e.g. '13+ years · Gas Safe registered · 2,000+ jobs'" }
          }
        },
        "accreditations": {
          "type": "array",
          "description": "Certifications / accreditations the business genuinely holds.",
          "items": {
            "type": "object",
            "required": ["title"],
            "properties": {
              "icon": {
                "type": "string",
                "enum": ["ShieldCheck", "BadgeCheck", "Award", "Leaf", "Clock", "Users", "Star", "Tag"],
                "description": "Trust icon (defaults to ShieldCheck if omitted or off-list)"
              },
              "title": { "type": "string", "description": "e.g. 'Gas Safe Registered'" },
              "sub": { "type": "string", "description": "e.g. 'Reg. 554321'" }
            }
          }
        }
      }
    },
    "reviews": {
      "type": "object",
      "description": "Structured review data (settings.structuredData.reviews) + the review-cells trust bar. DMCC Act 2024: only enable with REAL, publicly visible reviews — fabricated ratings are illegal. Default: disabled, so onboard never writes a rating unless you opt in.",
      "properties": {
        "enabled": {
          "type": "boolean",
          "default": false,
          "description": "Enable the reviews schema + review-cells trust bar. Only true if the reviews are genuinely visible on the site and real."
        },
        "aggregate": {
          "type": "object",
          "description": "Aggregate rating — only written when enabled AND reviewCount > 0. Use real, verifiable numbers.",
          "properties": {
            "ratingValue": { "type": "number", "description": "e.g. 4.9" },
            "reviewCount": { "type": "integer", "description": "Real number of reviews behind the rating" },
            "bestRating": { "type": "number", "default": 5 },
            "worstRating": { "type": "number", "default": 1 }
          }
        },
        "platforms": {
          "type": "array",
          "description": "Per-platform ratings for the review-cells trust bar (written only when enabled). Only add platforms with real, publicly visible reviews.",
          "items": {
            "type": "object",
            "required": ["platform"],
            "properties": {
              "platform": { "type": "string", "description": "e.g. 'Google', 'Checkatrade', 'Trustpilot'" },
              "score": { "type": "string", "description": "e.g. '4.9'" },
              "subLabel": { "type": "string", "description": "e.g. '127 reviews'" },
              "showStars": { "type": "boolean", "default": true }
            }
          }
        }
      }
    },
    "services": {
      "type": "array",
      "minItems": 1,
      "items": {
        "type": "object",
        "required": ["name", "slug"],
        "properties": {
          "name": { "type": "string", "description": "Display name — e.g. 'Interior Painting'" },
          "slug": { "type": "string", "description": "URL slug — e.g. 'interior-painting'" },
          "keyword": { "type": "string", "description": "The real PRIMARY SEARCH term for this service (what people actually type) — e.g. 'bathroom renovation', NOT the marketing name 'Luxury Bathroom Design & Renovation'. Becomes the page's gated H1 keyword AND the DataForSEO suggestion seed. Leave blank to fall back to the service name (often a zero-volume term)." },
          "summary": { "type": "string", "description": "One-line description for cards/listings (optional)" },
          "details": { "type": "string", "description": "The real specifics the client confirmed about THIS service — what's included, brands fitted, process, typical jobs, any genuine guarantee. This is the ONLY pool of facts the copy generator may state about the service; it must not invent accreditations, prices, warranties, response times or stats beyond what's written here + the trust block." },
          "icon": { "type": "string", "description": "Lucide icon name — e.g. 'Paintbrush' (optional)" },
          "order": { "type": "integer", "description": "Display order (optional)" }
        }
      }
    },
    "areas": {
      "type": "array",
      "minItems": 1,
      "items": {
        "type": "object",
        "required": ["name", "slug"],
        "properties": {
          "name": { "type": "string" },
          "slug": { "type": "string" },
          "keyword": { "type": "string", "description": "Optional override for the area page's primary keyword (default '<trade> <area>', which is usually already searchable)." },
          "order": { "type": "integer" }
        }
      }
    },
    "founder": {
      "type": "object",
      "description": "Optional — for Organization structured data.",
      "properties": {
        "name": { "type": "string" },
        "jobTitle": { "type": "string" },
        "sameAs": { "type": "string", "description": "LinkedIn or personal site URL" }
      }
    },
    "openingHours": {
      "type": "array",
      "items": { "type": "string" },
      "description": "If set, creates openingHours on LocalBusiness. Format: 'Mo-Fr 08:00-17:00'"
    },
    "serviceAreaOnly": {
      "type": "boolean",
      "description": "True if business has no public address (SAB). Skips address + geo in LocalBusiness.",
      "default": false
    }
  }
}
